CandidateID,CandidateName,AGE_YR,Gender,PoliticalPartyName,SYMBOLCODE,SymbolName,CTZDIST_ID,DistrictName,StateName,STATE_ID,SCConstID,ConstName,TotalVoteReceived,R,E_STATUS,DOB,CTZDIST,FATHER_NAME,SPOUCE_NAME,QUALIFICATION,NAMEOFINST,EXPERIENCE,OTHERDETAILS,ADDRESS
340117,दीपक बहादुर धामी,32,पुरुष,नेपाल कम्युनिष्ट पार्टी (एकीकृत मार्क्सवादी लेनिनवादी),2598,सुर्य,70,डोटी,सुदूरपश्चिम प्रदेश,7,1,1,0,1,,32,डोटी,मान बहादुर धामी,जयन्ती  कार्की,स्नातक,"नेपाल स्वास्थ्य विज्ञान अध्ययन संस्थान, पिएन क्याम्पस, पोखरा",,,डोटी शिखर नगरपालिका 
341208,भरत बहादुर खड्का,68,पुरुष,नेपाली काँग्रेस,2583,रुख,70,डोटी,सुदूरपश्चिम प्रदेश,7,1,1,0,1,,68,डोटी,दिर्घ सिँ खड्का,रतना देवी खड्का,स्नातक तह,डोटी बहुमुखी क्यम्पस,"डोटी जिल्ला सभापति र उपसभापतिको भुमिका निर्वाह गरिसकेको, प्रदेश सभा सांसद क्षेत्र क को भुमिका निर्वाह, सामाजिक अभियानकर्ता भई कार्य गरेको","डोटी जिल्लामा रहेका सम्भावनाहरुलाई एकीकृत गरि प्रदेश र स्थानीय तहहरुसंग समन्वय सहकार्य गरी, गरिबी न्यूनीकरण, सुशासन र रोजगारी प्रवद्धन समेत अन्य",डोटी पूर्वीचौकी गाउँपालिका गैराघर टोल
339731,त्रिलोचन भट्ट,56,पुरुष,नेपाली कम्युनिष्ट पार्टी,2557,पाँचकुने तारा,70,डोटी,सुदूरपश्चिम प्रदेश,7,1,1,0,1,,56,डोटी,प्रसाद  भट्ट,दुर्का देवी भट्ट,,,"२०४५ साल अखिल भारत नेपाली एकता समाज सदस्य, २०४६ साल नेपाल कम्युनिष्ट पार्टी एकता केन्द्र समेत",२०७४ साल देखि २०७९ सालसम्म सुदूरपश्‍चिम प्रदेशको संस्थापक मुख्यमन्त्री,डोटी के.आई.सिंह गाउँपालिका फलेडी
340378,नरेन्द्र बहादुर खडका,53,पुरुष,राष्ट्रिय स्वतन्त्र पार्टी,2528,घण्टी,70,डोटी,सुदूरपश्चिम प्रदेश,7,1,1,0,1,,53,डोटी,प्रेम सिं खडका,सारदा  खडका,आईकम पास,राम मनोहर लोहिया नाइट जुनियर कलेज मुम्बई भारत,२०५३ देखि २०६१ सम्म अध्यापन गराएको र समाजसेवा समेत गरेको,"डोटी जिल्लाको सामाजिक विकासमा सहभागी भई खप्तड, बडीकेदार कृर्षी व्यापार व्यवसायलाई समृद्धि स सुशासन कायम गर्दै आएको छु।",डोटी पूर्वीचौकी गाउँपालिका डुग्री
341050,खडक वहादुर अग्रवाल,41,पुरुष,राष्ट्रिय प्रजातन्त्र पार्टी,2604,हलो,70,डोटी,सुदूरपश्चिम प्रदेश,7,1,1,0,1,,41,डोटी,दल वहादुर अग्रवाल,-,I ED,,,,डोटी दिपायल सिलगढी नगरपालिका कुलपाते
339535,खगेन्द्र बहादुर शाही,58,पुरुष,नेपाल मजदुर किसान पार्टी,2578,मादल,70,डोटी,सुदूरपश्चिम प्रदेश,7,1,1,0,1,,58,दैलेख,भिम बहादुर शाही,तुलक्षा कुमारी शाही,स्नातक तह,सुर्खेत क्याम्पस शिक्षा,नेपाल मजदुर किसान पार्टीको सदस्य भई जनताको सेवामा समर्पित,नेपाल मजदुर किसान पार्टीको सिद्धान्त अनुसार देशमा कामदार जनताको हित हुने समाजवादी व्यवस्थापनको लागि जनताबिच जाने महत्वपूर्ण अवसरको रुपमा निर्वाचनलाई उपयोग गर्ने।,कैलाली लम्कीचुहा नगरपालिका अमरपुर
339913,मणिराज भट्ट,55,पुरुष,राष्ट्रिय जनमोर्चा,2522,गिलास,70,डोटी,सुदूरपश्चिम प्रदेश,7,1,1,0,1,,55,डोटी,नन्दलाल  भट्ट,गीता  भट्ट (रिजाल),कानूनमा स्नातक,त्रिभुवन विश्‍वविद्यालय नेपाल,,,डोटी के.आई.सिंह गाउँपालिका वालावन
341343,सरस्वती कुमारी पाल (मल्ल),35,महिला,मितेरी पार्टी नेपाल,2530,घोडा,70,डोटी,सुदूरपश्चिम प्रदेश,7,1,1,0,1,,35,डोटी,विर  बहादुर पाल,मदन  मल्ल,स्नातक,कैलाली बहुमुख क्याम्पस,,,कैलाली जोशीपुर गाउँपालिका डहविरिया
340860,प्रकास कठायत,29,पुरुष,नेपाल कम्युनिस्ट पार्टी (माओवादी),2526,गोलो घेराभित्र दुई पात भएको गुलाफको फूल,70,डोटी,सुदूरपश्चिम प्रदेश,7,1,1,0,1,,29,डोटी,विर वहादुर कठायत,-,12 पास,सरस्वती मा.वि. रानागाउ डोटी,,,डोटी के.आई.सिंह गाउँपालिका स्याला
